created_at,id_str,full_text,quote_count,reply_count,retweet_count,favorite_count,lang,user_id_str,conversation_id_str,username,tweet_url
Tue Jul 18 23:48:00 +0000 2023,1681450778475790344,"Prabowo mengaku tersanjung menerima kunjungan Budiman. Sebagai sosok yang dulu pernah berseberangan, Prabowo mengatakan dirinya sangat menghormati kedatangan Budiman.",0,1,0,0,in,1607710462120202241,1681450724864167936,DKliktivisme,https://twitter.com/DKliktivisme/status/1681450778475790344
Tue Jul 18 23:47:58 +0000 2023,1681450769961353218,"Kita bicara ternyata banyak pemikiran kita yang sama. Bahwa di tengah keadaan global seperti ini, tantangan-tantangan yang kita hadapi tidak ringan, kita menghadapi kondisi geopolitik,"" kata Prabowo.""",0,1,0,0,in,1607710462120202241,1681450724864167936,DKliktivisme,https://twitter.com/DKliktivisme/status/1681450769961353218
Tue Jul 18 23:47:57 +0000 2023,1681450765804773376,"Karena Indonesia merupakan kapal besar, bukan panggung entertainment saja,"" katanya.   Prabowo juga menilai persatuan bangsa merupakan kunci untuk mencapai keberhasilan menghadapi berbagai tantangan geopolitik.""",0,1,0,0,in,1607710462120202241,1681450724864167936,DKliktivisme,https://twitter.com/DKliktivisme/status/1681450765804773376
Tue Jul 18 23:47:56 +0000 2023,1681450761442693120,"Ketua Umum Relawan Prabowo Mania 08, menyebut Gus Muhaimin sebagai calon wakil presiden yang ideal untuk mendampingi Prabowo Subianto. Sehingga Prabowo bisa memenangkan Pilpres 2024 jika menggandeng Gus Muhaimin.  #GusIminKunciPilpres #MuhaiminIskandar #PartaiKebangkitanBangs https://t.co/nu2bdC5Np2",0,0,0,1,in,1450299010426695685,1681450761442693120,MaranArif,https://twitter.com/MaranArif/status/1681450761442693120
Tue Jul 18 23:47:52 +0000 2023,1681450748071280640,"Pernyataan tersebut ia sampaikan usai bertemu Prabowo di Kertanegara, Jakarta, Selasa (18/7/2023) malam.  Kapal Indonesia harus dikayuh oleh orang yang paham strategi, paham geopolitik, paham sejarah,"" kata Budiman.""",0,1,0,0,in,1607710462120202241,1681450724864167936,DKliktivisme,https://twitter.com/DKliktivisme/status/1681450748071280640
Tue Jul 18 23:47:51 +0000 2023,1681450743331708928,"Jakarta – Politikus PDIP Budiman Sudjatmiko menyatakan dukungannya pada Ketua Umum Partai Gerindra Prabowo Subianto, untuk membangun masa depan Tanah Air.   Menurutnya, 'kapal besar' Indonesia butuh dikayuh oleh sosok terbaik bangsa yang paham strategi, geopolitik maupun sejarah. https://t.co/aqHX2wAQED",0,1,0,0,in,1607710462120202241,1681450724864167936,DKliktivisme,https://twitter.com/DKliktivisme/status/1681450743331708928
Tue Jul 18 23:47:47 +0000 2023,1681450724864167936,Prabowo dan Budiman Sudjatmiko Gagas Pentingnya Persatuan di Kartanegara https://t.co/naK9bpR9ym,0,1,0,0,in,1607710462120202241,1681450724864167936,DKliktivisme,https://twitter.com/DKliktivisme/status/1681450724864167936
Tue Jul 18 23:47:46 +0000 2023,1681450722813165568,@Tjel0up Pak jokowi itu pemimpin yg arif dan bijaksana menurut pak prabowo 😊 https://t.co/tEbXpcmAjL,0,1,0,0,in,1088811396052209664,1681368083607461888,Bos_Boscang,https://twitter.com/Bos_Boscang/status/1681450722813165568
Tue Jul 18 23:47:44 +0000 2023,1681450713195642886,@alisyarief Langaunf ko di ronde pertama.. merapat ke prabowo..duel prabowo ganjar,0,0,0,0,in,1019941370172092419,1681172224722735104,Aanptp,https://twitter.com/Aanptp/status/1681450713195642886
Tue Jul 18 23:47:32 +0000 2023,1681450661609897987,@nyonyahsyuper Aamiiinn… Matursuwun mbakyu,0,0,0,1,in,158912165,1681447669972238336,JHPrabowo,https://twitter.com/JHPrabowo/status/1681450661609897987
Tue Jul 18 23:47:31 +0000 2023,1681450656585089025,"@AndreasSolusi @AuntyNovi1978 @Chaves1305 @bengkeldodo @genx36545403 @prabowo @jokowi @Alie_Fahnoor @are_inismyname @BANGSAygSUJUD @Ndons_Back @propaganda_99 @Kimberley_2024 @alextham878 @budimandjatmiko @ch_chotimah2 Baru aja baca di lapak pengarang sajak,",0,1,0,2,in,1244536424793174016,1681298442935762944,Rara29803002,https://twitter.com/Rara29803002/status/1681450656585089025
Tue Jul 18 23:47:27 +0000 2023,1681450642190270464,"@MurtadhaOne1 @nusantaranimist @budimandjatmiko @77bayoe Yess,ini malah feeling saya om bud lobby2 nyatukan pak ganjar dan pak prabowo😃",0,0,0,14,in,1582511377997930496,1681358625514860546,BernehParaga,https://twitter.com/BernehParaga/status/1681450642190270464
Tue Jul 18 23:47:27 +0000 2023,1681450641208803334,"@VIVAcoid Ya lu pindah partai aja dari PDIP ke Gerindra (Prabowo terpilih, siapa tau lu diangkat jadi menteri). Gitu aja kok pengumuman, Bud...bud. 😁",0,0,0,0,in,1550030996493729797,1681336295275253762,HenryS75761541,https://twitter.com/HenryS75761541/status/1681450641208803334
Tue Jul 18 23:47:21 +0000 2023,1681450615950708736,Relawan Prabowo Mania 08 memandatkan Gus Muhaimin untuk menjadi cawapres.  #GusIminKunciPilpres #MuhaiminIskandar #PartaiKebangkitanBangsa https://t.co/pjcJAMS5EV,0,0,0,0,in,556646683,1681450615950708736,Febianno_147,https://twitter.com/Febianno_147/status/1681450615950708736
Tue Jul 18 23:47:21 +0000 2023,1681450615510302721,"@Dahnilanzar @budimandjatmiko @prabowo Yg di tampilkan di depan umum, seperti pembenci prabowo dan sebaliknya , rakyat pendukung melihat dan merasakan akan tertular rasa bencinya . Itu namanya tebar2 benci. Jadi walaupun seperti "" g usahlah di tampilkan kebencian walaupun ""seperti""""",0,0,0,0,in,357265391,1681445902400258052,abu_fallah,https://twitter.com/abu_fallah/status/1681450615510302721
Tue Jul 18 23:47:12 +0000 2023,1681450579229564929,Gus Muhaimin ternyata  cawapres ideal Prabowo. InsyaAllah menang. @cakimiNOW @prabowo @EmHasanuddin @Jazilul_Fawaid @zainul_munas @HasanRofiqi4 @Brigade01Arwan1 @Mursyidan10 #GusIminKunciPilpres #MuhaiminIskandar #PartaiKebangkitanBangsa https://t.co/0xNBxElUpl,0,0,1,2,in,933220179043016704,1681450579229564929,Desky_Bawwel,https://twitter.com/Desky_Bawwel/status/1681450579229564929
Tue Jul 18 23:47:10 +0000 2023,1681450572061474816,"@wahabi92013848 Prabowo mantan militer.... Terdisik dan terlatih... Pak jokowi aja orang sipil kuat, apalagi pak prabowo... FAKTA!!!",0,0,0,0,in,456219471,1681151734197137408,dedi_dulhalim,https://twitter.com/dedi_dulhalim/status/1681450572061474816
Tue Jul 18 23:47:07 +0000 2023,1681450556529999873,@parlinburman84 Ngopi dulu om,0,0,0,1,in,158912165,1681449571774496768,JHPrabowo,https://twitter.com/JHPrabowo/status/1681450556529999873
Tue Jul 18 23:47:05 +0000 2023,1681450549437431810,Menhan Prabowo Subianto Tegaskan Laut Merupakan Masa Depan ... - Industry #prabowo #prabowosubianto #prabowountuksemua https://t.co/0rWAtoE9FO,0,0,7,0,in,1068101963059879936,1681450549437431810,AdrianaDaneen,https://twitter.com/AdrianaDaneen/status/1681450549437431810
Tue Jul 18 23:47:05 +0000 2023,1681450547973619716,Menhan Prabowo Subianto Tegaskan Laut Merupakan Masa Depan ... - Industry #PrabowoNeruskePakdhe #PrabowoSubianto #PrabowoUntukSemua https://t.co/EvvULYZZwv,0,0,8,0,in,4562051414,1681450547973619716,JemangiJ6598,https://twitter.com/JemangiJ6598/status/1681450547973619716
Tue Jul 18 23:46:42 +0000 2023,1681450451420721152,Relawan Prabowo Mania 08 memandatkan Gus Muhaimin untuk menjadi cawapres.  #GusIminKunciPilpres #MuhaiminIskandar #PartaiKebangkitanBangsa https://t.co/pIReUaBbLa,0,0,0,0,in,556646683,1681450451420721152,Febianno_147,https://twitter.com/Febianno_147/status/1681450451420721152
Tue Jul 18 23:46:37 +0000 2023,1681450433792057344,"@nirwan_anestesi Yaa salam,, semoga segera sehat ya om Dok  ayahnya 🤲",0,1,0,1,in,158912165,1681436724118061068,JHPrabowo,https://twitter.com/JHPrabowo/status/1681450433792057344
Tue Jul 18 23:46:21 +0000 2023,1681450366330888192,Sisi buruk dan gelap Prabowo Subianto  di bahas semua oleh mantan Intel CIA https://t.co/45UP8rs725,0,0,0,0,in,1618301180396068864,1681450366330888192,Tondijii,https://twitter.com/Tondijii/status/1681450366330888192
Tue Jul 18 23:46:12 +0000 2023,1681450328506662916,"*Gus Muhaimin Kunci Pilpres 2024*  Ketua Umum Relawan Prabowo Mania 08, Immanuel Ebenezer menyebut Gus Muhaimin sebagai calon wakil presiden yang ideal untuk mendampingi Prabowo Subianto.    #GusIminKunciPilpres #MuhaiminIskandar #PartaiKebangkitanBangsa https://t.co/P3hUQsA3UF",0,0,0,0,in,1678086319879385088,1681450328506662916,gubukronggo,https://twitter.com/gubukronggo/status/1681450328506662916
Tue Jul 18 23:46:08 +0000 2023,1681450308894097413,@PartaiSocmed @jokowi Penjilat prabowo,0,0,0,0,in,1631292430002651148,1681215771350016002,Menjaditerang1,https://twitter.com/Menjaditerang1/status/1681450308894097413
Tue Jul 18 23:45:58 +0000 2023,1681450268184182788,"Ketua Umum Relawan Prabowo Mania 08, Immanuel Ebenezer menyebut Gus Muhaimin sebagai calon wakil presiden yang ideal untuk mendampingi Prabowo Subianto. Disebutnya   #GusIminKunciPilpres #MuhaiminIskandar #PartaiKebangkitanBangsa https://t.co/sWUqYQEiIQ",0,0,0,0,in,556646683,1681450268184182788,Febianno_147,https://twitter.com/Febianno_147/status/1681450268184182788
Tue Jul 18 23:45:29 +0000 2023,1681450147472084992,Prabowo bisa memenangkan Pilpres 2024 jika menggandeng Gus Muhaimin &amp  Relawan Prabowo Mania 08 memandatkan Gus Muhaimin untuk menjadi cawapres.  #GusIminKunciPilpres #MuhaiminIskandar #PartaiKebangkitanBangsa https://t.co/xujvk4dDbp,0,0,0,0,in,556646683,1681450147472084992,Febianno_147,https://twitter.com/Febianno_147/status/1681450147472084992
Tue Jul 18 23:45:07 +0000 2023,1681450056300511232,Dah gitu mereka percaya   Wkakakakaka,0,1,0,1,in,158912165,1681450056300511232,JHPrabowo,https://twitter.com/JHPrabowo/status/1681450056300511232
Tue Jul 18 23:45:07 +0000 2023,1681450052571791361,"Menurut gw, manuver Mas Budiman krn dua hal:  1. PDIP yg terlalu nyetir Ganjar, alih2 memberi kebebasan buat Capresnya agar lebih inklusive dan merangkul semua.  2. Diehard Ganjar yg massive serang Prabowo. Pakde ga suka ini, krn musuh yg seharusnya diserang adl kubu Anies.",0,1,1,0,in,159741866,1681450052571791361,BuayaEmpang,https://twitter.com/BuayaEmpang/status/1681450052571791361
Tue Jul 18 23:44:52 +0000 2023,1681449992953937925,"@pengarang_sajak Ya betul sih, karna pak Prabowo hati nya belum selapang Bu Mega, kalau dilihat  Bu Mega 3 kali kalah 1x lawan Gus Dur 2x lawan sby membatasi dirinya buat gak maju lagi, kalau pak Prabowo gak seperti itu, itulah salah satu alasanku gak milih pak prabowo",0,2,3,11,in,1468168681376993283,1681444901924507648,JonathanRegulus,https://twitter.com/JonathanRegulus/status/1681449992953937925
Tue Jul 18 23:44:25 +0000 2023,1681449879397367808,@anak_5okin @tanyarlfes 😂😂 kopi manaa,0,1,0,0,in,158912165,1681160921409003521,JHPrabowo,https://twitter.com/JHPrabowo/status/1681449879397367808
Tue Jul 18 23:44:18 +0000 2023,1681449848065916928,@JarnasABWBpn @SIR_Pribadi kata pendukung anis ya anis yg terbaik. kata pendukung ganjar ya ganjar yg ter baik. kata saya Pak @prabowo yg terbaik.,0,0,0,0,in,733932966229856256,1681133834174349312,Kumayandjati,https://twitter.com/Kumayandjati/status/1681449848065916928
Tue Jul 18 23:44:07 +0000 2023,1681449801911795712,"Hasto PDIP Puji Andika Tak Pernah Beli Pesawat Bekas, Sindir Prabowo? - https://t.co/PsQJkx1iFm #Prabowo #BangkitBersama https://t.co/pJ1ubhIxeg",0,0,0,0,in,465458275,1681449801911795712,Disuruh_Iben,https://twitter.com/Disuruh_Iben/status/1681449801911795712
Tue Jul 18 23:44:05 +0000 2023,1681449795100246020,Pakar Kesehatan Menilai Cara Atasi Stunting Tidak Sesederhana Ucapan Prabowo Subianto - https://t.co/tRNS3ctLij #Prabowo #BangkitBersama https://t.co/O0rQbHQ5Ob,0,0,0,0,in,465458275,1681449795100246020,Disuruh_Iben,https://twitter.com/Disuruh_Iben/status/1681449795100246020
Tue Jul 18 23:44:03 +0000 2023,1681449785331707905,16 Survei Terbaru Capres-Cawapres: Ganjar Vs Anies Vs Prabowo Subianto - CNBC Indonesia #Prabowo #BangkitBersama https://t.co/u3RoSJS9Ko,0,0,0,0,in,465458275,1681449785331707905,Disuruh_Iben,https://twitter.com/Disuruh_Iben/status/1681449785331707905
Tue Jul 18 23:44:01 +0000 2023,1681449777295425538,pdip ganjar andhika gerindra pkb prabowo muhaimin nasdem demokrat pks golkar anies gatot  game changer bro 3 paslon. tetap saja aku restu antara prabowo n anies cuma ya kita tau @Rothschild_DHBA aukus barat lebih restu @aniesbaswedan pakdhe @jokowi juga diam2 ke anies jga hehehe https://t.co/udASgDTwJv,0,0,0,0,in,720593195562733570,1681449777295425538,anjares90,https://twitter.com/anjares90/status/1681449777295425538
Tue Jul 18 23:43:47 +0000 2023,1681449716981334017,"@budimandjatmiko Deal nggak pak,prabowo RI 2?🤭🤭😁",0,0,0,0,in,1582511377997930496,1681358625514860546,BernehParaga,https://twitter.com/BernehParaga/status/1681449716981334017
Tue Jul 18 23:43:46 +0000 2023,1681449713894326281,"Partai Bulan Bintang (PBB) telah memutuskan mendukung bakal capres dari Partai Gerindra, Prabowo Subianto, di Pilpres 2024. Deklarasi dukungan PBB tersebut direncanakan akan dilakukan akhir bulan ini.  https://t.co/vwy5Mwaj8o https://t.co/5FmVbNKiQL",0,0,0,0,in,1073425152,1681449713894326281,OfficialDPP_PBB,https://twitter.com/OfficialDPP_PBB/status/1681449713894326281
Tue Jul 18 23:43:41 +0000 2023,1681449694634078208,"Kita sudah menjadi bumi yang kecil di mana satu sama lain berhubungan dan ada ketergantungan. Indonesia perlu persatuan, persatuan ini tidak boleh dianggap enteng, kata Prabowo.""",0,1,0,0,in,1607761166255943682,1681449611347783680,indeks_politika,https://twitter.com/indeks_politika/status/1681449694634078208
Tue Jul 18 23:43:39 +0000 2023,1681449685884764164,"Prabowo mengatakan, pertemuan yang berlangsung hampir dua jam itu membahas berbagai persoalan bangsa. Salah satunya terkait pentingnya persatuan bagi Indonesia dalam menghadapi ancaman krisis global.",0,1,0,0,in,1607761166255943682,1681449611347783680,indeks_politika,https://twitter.com/indeks_politika/status/1681449685884764164
Tue Jul 18 23:43:38 +0000 2023,1681449681585598464,"Saya mendapat kehormatan kunjungan dari saudara Budiman Sudjatmiko bersama beberapa kawan-kawannya. Tadi cukup lama berdiskusi, kita mempunyai kesamaan visi, kesamaan pandangan,"" kata Prabowo.""",0,1,0,0,in,1607761166255943682,1681449611347783680,indeks_politika,https://twitter.com/indeks_politika/status/1681449681585598464
Tue Jul 18 23:43:38 +0000 2023,1681449681052925959,PDIP Buka Peluang Ganjar Jadi Cawapres Prabowo  Nah ini baru seru... Ayo jadiin aja @PDI_Perjuangan @Gerindra  WOWO praboWO-pranoWO https://t.co/tjwPxF2uA5,6,39,14,51,in,1084569967394095104,1681449681052925959,_bangagoengDuA,https://twitter.com/_bangagoengDuA/status/1681449681052925959
Tue Jul 18 23:43:36 +0000 2023,1681449673364766723,"Prabowo mengaku tersanjung menerima kunjungan Budiman. Sebagai sosok yang dulu pernah berseberangan, Prabowo mengatakan dirinya sangat menghormati kedatangan Budiman.",0,1,0,0,in,1607761166255943682,1681449611347783680,indeks_politika,https://twitter.com/indeks_politika/status/1681449673364766723
Tue Jul 18 23:43:33 +0000 2023,1681449660085583872,"Karena Indonesia merupakan kapal besar, bukan panggung entertainment saja,"" katanya.   Prabowo juga menilai persatuan bangsa merupakan kunci untuk mencapai keberhasilan menghadapi berbagai tantangan geopolitik.""",0,1,0,0,in,1607761166255943682,1681449611347783680,indeks_politika,https://twitter.com/indeks_politika/status/1681449660085583872
Tue Jul 18 23:43:21 +0000 2023,1681449611347783680,Budiman Sudjatmiko Merapat ke Prabowo Subianto https://t.co/QeVQSHamYX,0,1,0,0,in,1607761166255943682,1681449611347783680,indeks_politika,https://twitter.com/indeks_politika/status/1681449611347783680
Tue Jul 18 23:43:21 +0000 2023,1681449608789262344,"Dapat Dukungan Relawan JoMan, Prabowo: Saya Tambah Muda 23 Tahun - https://t.co/vZIWoTfBeY #Prabowo #BangkitBersama https://t.co/fC7de8B0Vr",0,0,0,0,in,465458275,1681449608789262344,Disuruh_Iben,https://twitter.com/Disuruh_Iben/status/1681449608789262344
Tue Jul 18 23:43:19 +0000 2023,1681449601906376704,Berita Prabowo :  Ketum Gerindra Prabowo Subianto sebut siap bertemu dengan Ketum PDIP Megawati - ANTARA Jawa Barat #Prabowo #BangkitBersama https://t.co/Hr3lhjY4XC,0,0,0,0,in,465458275,1681449601906376704,Disuruh_Iben,https://twitter.com/Disuruh_Iben/status/1681449601906376704
Tue Jul 18 23:43:17 +0000 2023,1681449594511851521,"Berita Prabowo :  Relawan Prabowo Subianto Klaim Gibran Layak Lebih, Tak Cuma Jadi Jurkam Capres - CNN Indonesia #Prabowo #BangkitBersama https://t.co/mogGLF8wcP",0,0,0,0,in,465458275,1681449594511851521,Disuruh_Iben,https://twitter.com/Disuruh_Iben/status/1681449594511851521
Tue Jul 18 23:43:15 +0000 2023,1681449586861441026,"Berita Prabowo :  Hasto PDIP Puji Andika Tak Pernah Beli Pesawat Bekas, Sindir Prabowo Subianto? - https://t.co/PsQJkx1iFm #Prabowo #BangkitBersama https://t.co/F0brxUlZjd",0,0,0,0,in,465458275,1681449586861441026,Disuruh_Iben,https://twitter.com/Disuruh_Iben/status/1681449586861441026
Tue Jul 18 23:43:14 +0000 2023,1681449579500437504,Berita Prabowo :  Pakar Kesehatan Menilai Cara Atasi Stunting Tidak Sesederhana Ucapan Prabowo Subianto - https://t.co/tRNS3ctLij #Prabowo #BangkitBersama https://t.co/RbRCAZP73R,0,0,0,0,in,465458275,1681449579500437504,Disuruh_Iben,https://twitter.com/Disuruh_Iben/status/1681449579500437504
Tue Jul 18 23:43:10 +0000 2023,1681449564484829185,Berita Prabowo :  Eks Menteri Pertanian Sebut Prabowo Subianto Sosok Pemimpin yang Bernyali Besar - Republika Online #Prabowo #BangkitBersama https://t.co/2cXOEpBYMA,0,0,0,0,in,465458275,1681449564484829185,Disuruh_Iben,https://twitter.com/Disuruh_Iben/status/1681449564484829185
Tue Jul 18 23:43:08 +0000 2023,1681449556888920064,Berita Prabowo :  16 Survei Terbaru Capres-Cawapres: Ganjar Vs Anies Vs Prabowo Subianto - CNBC Indonesia #Prabowo #BangkitBersama https://t.co/d9rfFWCbO2,0,0,0,0,in,465458275,1681449556888920064,Disuruh_Iben,https://twitter.com/Disuruh_Iben/status/1681449556888920064
Tue Jul 18 23:43:07 +0000 2023,1681449549578256384,Berita Prabowo :  Prabowo Subianto Subianto Sapa Warga sambil Santap Nasi Timbel - Jawa Pos - JawaPos #Prabowo #BangkitBersama https://t.co/eb6IELqdoV,0,0,0,0,in,465458275,1681449549578256384,Disuruh_Iben,https://twitter.com/Disuruh_Iben/status/1681449549578256384
Tue Jul 18 23:43:05 +0000 2023,1681449541579735042,"Berita Prabowo :  Dapat Dukungan Relawan JoMan, Prabowo Subianto: Saya Tambah Muda 23 Tahun - https://t.co/vZIWoTfBeY #Prabowo #BangkitBersama https://t.co/EPKHIeLWkD",0,0,0,0,in,465458275,1681449541579735042,Disuruh_Iben,https://twitter.com/Disuruh_Iben/status/1681449541579735042
Tue Jul 18 23:43:03 +0000 2023,1681449534256480259,"@David68159347 @genx36545403 @prabowo @jokowi @Alie_Fahnoor @are_inismyname @AndreasSolusi @BANGSAygSUJUD @bengkeldodo @Chaves1305 @Ndons_Back @propaganda_99 @Kimberley_2024 @alextham878 @budimandjatmiko Ya bro, saya bisa menangkap maksud anda",0,1,0,1,in,1383301453528244224,1681298442935762944,sukmawijaya91,https://twitter.com/sukmawijaya91/status/1681449534256480259
Tue Jul 18 23:43:03 +0000 2023,1681449533237252098,@KangSemproel 😷😷😷 laa iyak,1,0,0,1,in,158912165,1681444680897298432,JHPrabowo,https://twitter.com/JHPrabowo/status/1681449533237252098
Tue Jul 18 23:43:02 +0000 2023,1681449530322219008,"Ketua Umum Relawan Prabowo Mania 08, Immanuel Ebenezer menyebut Gus Muhaimin sebagai calon wakil presiden yang ideal untuk mendampingi Prabowo Subianto. .  #GusIminKunciPilpres #MuhaiminIskandar #PartaiKebangkitanBangsa https://t.co/zfVpgBfZRt",0,0,0,0,in,556646683,1681449530322219008,Febianno_147,https://twitter.com/Febianno_147/status/1681449530322219008
Tue Jul 18 23:42:56 +0000 2023,1681449503600308224,@andre_rosiade @budimandjatmiko @prabowo SEMOGA ALLAH MEMBALAS SECEPATNYA YANG HINA DAN PEDIH KEPADA PARA PENGHIANAT RAKYAT INDONESIA... AAMIIIIIN...,0,0,0,3,in,1629127668733218818,1681346361067966464,Pejuang248,https://twitter.com/Pejuang248/status/1681449503600308224
Tue Jul 18 23:41:44 +0000 2023,1681449204571602944,"@andre_rosiade @budimandjatmiko @prabowo Itulah sebuah perjlanan, bebaskan semua orang untuk bereksoresi.",0,1,0,1,in,1058269575488299009,1681346361067966464,RumahGudeg,https://twitter.com/RumahGudeg/status/1681449204571602944
Tue Jul 18 23:41:59 +0000 2023,1681449266982846469,"@AndiSinulingga Urusin aja yohanes wan ngibul, krn junjunganmu sdh menghianati pak prabowo.",0,0,0,3,in,1340898502453338112,1681313596129837057,Ddy445879,https://twitter.com/Ddy445879/status/1681449266982846469
Tue Jul 18 23:41:35 +0000 2023,1681449163735842816,Ayo pung omelin aja gamparin aja,0,1,0,1,in,158912165,1681449163735842816,JHPrabowo,https://twitter.com/JHPrabowo/status/1681449163735842816
Tue Jul 18 23:41:04 +0000 2023,1681449036711362563,"Prabowo Gelar Pertemuan Tertutup dengan Budiman Sudjatmiko, Bahas Apa? https://t.co/57TjwKR4aB",0,0,0,0,in,2544978158,1681449036711362563,Kilas_berita_,https://twitter.com/Kilas_berita_/status/1681449036711362563
Tue Jul 18 23:40:54 +0000 2023,1681448994499887107,"Ketua Umum Relawan Prabowo Mania 08, Immanuel Ebenezer menyebut Gus Muhaimin sebagai calon wakil presiden yang idela   #GusIminKunciPilpres #MuhaiminIskandar #PartaiKebangkitanBangsa https://t.co/O6b5UdOvMI",0,0,0,0,in,1680248890753417216,1681448994499887107,Naluri01,https://twitter.com/Naluri01/status/1681448994499887107
Tue Jul 18 23:40:29 +0000 2023,1681448889877168131,@ForzaJuveEN Ane pegang omongan yg ini aja @gunsujatnika . Berita2 lain itu sumbernya kadang bener kadang ngaco.,0,0,0,0,in,92977801,1681276500279189509,akhbow,https://twitter.com/akhbow/status/1681448889877168131
Tue Jul 18 23:40:12 +0000 2023,1681448817856774159,@andre_rosiade @budimandjatmiko @prabowo Kurang sya saja ini Jenderal @prabowo !!,0,0,0,1,in,1365551927371567104,1681346361067966464,arie_sgm,https://twitter.com/arie_sgm/status/1681448817856774159
Tue Jul 18 23:40:10 +0000 2023,1681448807505219584,@KompasTV Yg ke Prabowo sdh pd tau klu Jokowi sebenarnya berpihak &amp  Mendukung Prabowo bkn Ganjar.,0,0,1,1,in,1640659056074563585,1681429274857971712,ayahiyan63,https://twitter.com/ayahiyan63/status/1681448807505219584
Tue Jul 18 23:40:07 +0000 2023,1681448798265180168,@moenaweir @DPP_PKB @cakimiNOW @prabowo @Gerindra @zainul_munas @Brigade01Arwan1 Mantap,0,0,0,0,in,1592437937391927296,1681277834462105606,LaksanaGuruh,https://twitter.com/LaksanaGuruh/status/1681448798265180168
Tue Jul 18 23:40:04 +0000 2023,1681448784000323584,@anak_5okin Wkakakaka masih pakek sarungan,0,1,0,0,in,158912165,1681431584774459392,JHPrabowo,https://twitter.com/JHPrabowo/status/1681448784000323584
Tue Jul 18 23:39:57 +0000 2023,1681448754812190721,"Ketua Relawan Prabowo Mania 08, Immanuel Ebenezer menyebut Gus Muhaimin sbg calon wakil presiden yang ideal utk mendampingi Prabowo Subianto. Shg Prabowo bisa memenangkan Pilpres 2024 jk menggandeng Gus Muhaimin. #GusIminKunciPilpres #MuhaiminIskandar #PartaiKebangkitanBangsa https://t.co/xAiVQxtAIk",0,0,0,0,in,556442530,1681448754812190721,syamsoelhadi82,https://twitter.com/syamsoelhadi82/status/1681448754812190721
Tue Jul 18 23:39:55 +0000 2023,1681448747958697991,"Saya yakin lo bkn pendukung Prabowo, lo menyusup mau gembosi  Prabowo. Prabowo sendiri yg bilang belisu timnya Jokowi.",0,0,0,1,in,1383301453528244224,1681448747958697991,sukmawijaya91,https://twitter.com/sukmawijaya91/status/1681448747958697991
Tue Jul 18 23:39:46 +0000 2023,1681448710180601856,"@Tjel0up @satrio_tone Yo ga mutu"" sampean ga dukung pak @prabowo  lagi 😊🤭""",0,1,0,0,in,1088811396052209664,1681368083607461888,Bos_Boscang,https://twitter.com/Bos_Boscang/status/1681448710180601856
Tue Jul 18 23:39:43 +0000 2023,1681448695286628355,"@AndiSinulingga Mulai main dua kaki rupanya...wahai @aniesbaswedan &amp  @prabowo orang macam dia ini mewarisi sifat orang belanda saat menjajah negeri ini, hati neis &amp  jg prabowo, suatu saat kalian bakal d adu domba oleh orang ini. Orang macam dia ini benalu yg hidupnya bergantung m pohon lain""",0,0,0,0,in,1604107619610021888,1681313596129837057,alqodrifaqih,https://twitter.com/alqodrifaqih/status/1681448695286628355
Tue Jul 18 23:39:42 +0000 2023,1681448693109764096,@DoankWarto Kalau di lihat rasa Masionalis yang kuat Jelas Prabowo buktinya beliau bersedia bersama Jokowi untuk menyelamatkan negara dengan bergabung menjadi mentrinya sekalipun ditentang pendukungnya yg setia. 🙏,0,2,0,3,in,1605048672500125698,1681402461377155073,nunungmar1404,https://twitter.com/nunungmar1404/status/1681448693109764096
Tue Jul 18 23:39:07 +0000 2023,1681448544308461569,@andre_rosiade @budimandjatmiko @prabowo Wah klo mas budiman masuk jadi salah satu kandidat wapres pak prabowo bakalan seru ini,0,0,1,2,in,184956840,1681346361067966464,yudi732002,https://twitter.com/yudi732002/status/1681448544308461569
Tue Jul 18 23:39:00 +0000 2023,1681448513832648704,@andre_rosiade @budimandjatmiko @prabowo Salot dengan sosok baju batik kedepan pasti punya label bersertifikat orang paling berpengaruh di dunia politik beraliran kiri atau kanan kira kira Pham kan,0,0,0,0,in,1525057725176360960,1681346361067966464,jurnalistpemula,https://twitter.com/jurnalistpemula/status/1681448513832648704
Tue Jul 18 23:38:37 +0000 2023,1681448419955716096,"@budimandjatmiko Nunggu ending nya kaya gimana,untuk sekarang masih terumbang ambing kaya gini Untung seorang mas Bud yg idealis may berkrompomi dengan prabowo Politik tingkat tinggi !!",0,0,0,0,in,1543762788270895104,1681358625514860546,AgusAkew10,https://twitter.com/AgusAkew10/status/1681448419955716096
Tue Jul 18 23:38:00 +0000 2023,1681448262526730243,Selamat Tahun Baru Hijriah 1445  Prabowo Presiden Indonesia Menang  ___  @Gerindra @gerindra_jatim @Fraksi_Gerindra @prabowo @indadilmakmur  #gerindra #prabowo #gerindramenang #prabowopresiden #gerindralamongan #lamonganmegilan #politisisantri #muharram #tahunbaru https://t.co/PPG2sMg407,0,0,0,0,in,1545050750513950720,1681448262526730243,gerindra_la,https://twitter.com/gerindra_la/status/1681448262526730243
